{"schema":"https://diffra.dev/schemas/assessment-v1.schema.json","id":"sha256:5a8527d13d34bcce5744f5383e9b8f8bde95c6f1af8a8a5d10277396da71174c","deltaId":"sha256:b25cc925c47841be053cf744a44b393f30eedc505920c7f4678414a8b9901a88","deltaStatus":"changed","policy":{"id":"org.example.complexity-budget","version":"1.0.0","rulesDigest":"sha256:81a62a3eb77dcc2eb2756da618fa47aec4be41e748de3062e6295b051f173400"},"outcome":"warn","findings":[{"id":"numeric-policy:/complexity","status":"warn","message":"Numeric increase at \u0027/complexity\u0027 exceeds the warn threshold.","changePaths":["/complexity"],"observed":{"before":"4","after":"5","absolute":"1","relative":"0.25","relativeStatus":"defined"},"expected":{"absolute":"0"}}],"provenance":{"evaluator":"diffra.numeric-policy","version":"1.0.0","inputDeltaId":"sha256:b25cc925c47841be053cf744a44b393f30eedc505920c7f4678414a8b9901a88"}}